{
  "version": "1.0",
  "id": "shots-last-bus-v1",
  "scene_intent_id": "scene-last-bus",
  "continuity_bible_id": "bible-last-bus",
  "coverage_strategy": "A restrained four-shot progression: orient both characters, isolate Eli's evasion, cut to the untouched choice, then move closer on Mara's recognition.",
  "shots": [
    {
      "id": "SH001",
      "order": 1,
      "beat_ids": ["beat-offer"],
      "narrative_purpose": "Orient the relationship and make Mara's offer legible in one uninterrupted action.",
      "duration_seconds": 6.0,
      "subjects": ["mara", "eli"],
      "blocking": "Mara sits screen-left by the window; Eli sits screen-right by the aisle; Mara slides the envelope from her right hand toward table center.",
      "action": "Mara says the departure time and pushes the envelope halfway across the table; Eli stays still.",
      "performance_intent": "Mara hides urgency inside practical delivery; Eli's stillness should register as resistance.",
      "camera": {
        "shot_size": "medium-wide two-shot",
        "position": "open end of booth, three-quarter to both characters",
        "height": "seated eye level",
        "angle": "level",
        "movement": "locked-off",
        "field_of_view": "moderate normal",
        "focus": "deep enough to hold both faces and envelope",
        "composition": "Mara left, Eli right, envelope path visible between them"
      },
      "screen_direction": "Mara addresses screen-right; Eli addresses screen-left",
      "eyelines": {"mara": "Eli across table", "eli": "envelope then Mara"},
      "lighting_intent": "Preserve warm camera-left key and cooler background door spill.",
      "entrance_state": {
        "character_positions": {"mara": "window-side seat", "eli": "aisle-side seat"},
        "body_orientation": {"mara": "angled toward Eli", "eli": "square to table"},
        "eyelines": {"mara": "Eli", "eli": "table"},
        "movement_direction": {"mara": "right hand toward frame center", "eli": "still"},
        "current_action": "Mara covers the envelope with her right hand",
        "prop_states": {"ticket-envelope": "sealed beneath Mara's right hand"},
        "emotional_state": {"mara": "controlled hope", "eli": "defensive calm"},
        "camera_side": "open end of booth"
      },
      "exit_state": {
        "character_positions": {"mara": "window-side seat", "eli": "aisle-side seat"},
        "body_orientation": {"mara": "angled toward Eli", "eli": "square to table"},
        "eyelines": {"mara": "Eli", "eli": "envelope"},
        "movement_direction": {"mara": "hand settles at table center", "eli": "still"},
        "current_action": "The envelope has stopped halfway between them under Mara's fingertips",
        "prop_states": {"ticket-envelope": "sealed at table center under Mara's fingertips"},
        "emotional_state": {"mara": "hope under control", "eli": "avoidance exposed"},
        "camera_side": "open end of booth"
      },
      "continuity_refs": ["mara", "eli", "ticket-envelope"],
      "reference_assets": [],
      "edit_handles": {"head_seconds": 0.7, "tail_seconds": 0.8},
      "tolerances": ["Natural micro-movements are acceptable", "Rain pattern need not match exactly"]
    },
    {
      "id": "SH002",
      "order": 2,
      "beat_ids": ["beat-evasion"],
      "narrative_purpose": "Hold on Eli long enough for his practical sentence to become a refusal.",
      "duration_seconds": 5.0,
      "subjects": ["eli", "mara"],
      "blocking": "Eli remains aisle-side; Mara's soft shoulder is foreground-left; Eli looks down to the envelope then toward Mara only on the final word.",
      "action": "Eli does not touch the envelope and says she should leave before the rain.",
      "performance_intent": "Gentle evasion with a late, guilty eyeline; no overt sadness.",
      "camera": {
        "shot_size": "medium close-up over Mara's shoulder",
        "position": "Mara side of the open booth, still on established camera half-plane",
        "height": "seated eye level",
        "angle": "three-quarter on Eli",
        "movement": "locked-off",
        "field_of_view": "normal-to-mild portrait",
        "focus": "Eli's eyes; Mara shoulder soft",
        "composition": "Eli right-of-center with look room toward screen-left"
      },
      "screen_direction": "Eli looks screen-left toward Mara",
      "eyelines": {"eli": "envelope, then Mara screen-left", "mara": "Eli screen-right"},
      "lighting_intent": "Same warm key side; background door remains cool and subdued.",
      "entrance_state": {
        "character_positions": {"mara": "window-side seat", "eli": "aisle-side seat"},
        "body_orientation": {"mara": "angled toward Eli", "eli": "square to table"},
        "eyelines": {"mara": "Eli", "eli": "envelope"},
        "movement_direction": {"mara": "hand settled at table center", "eli": "still"},
        "current_action": "The envelope has stopped halfway between them under Mara's fingertips",
        "prop_states": {"ticket-envelope": "sealed at table center under Mara's fingertips"},
        "emotional_state": {"mara": "hope under control", "eli": "avoidance exposed"},
        "camera_side": "open end of booth"
      },
      "exit_state": {
        "character_positions": {"mara": "window-side seat", "eli": "aisle-side seat"},
        "body_orientation": {"mara": "angled toward Eli", "eli": "chin lifted slightly toward Mara"},
        "eyelines": {"mara": "Eli", "eli": "Mara screen-left"},
        "movement_direction": {"mara": "still", "eli": "eyes finish lifting left"},
        "current_action": "Eli finishes the line without touching the envelope",
        "prop_states": {"ticket-envelope": "sealed at table center under Mara's fingertips"},
        "emotional_state": {"mara": "hope collapsing", "eli": "shame beginning"},
        "camera_side": "open end of booth"
      },
      "continuity_refs": ["mara", "eli", "ticket-envelope"],
      "reference_assets": [],
      "edit_handles": {"head_seconds": 0.7, "tail_seconds": 0.8},
      "tolerances": ["Mara shoulder silhouette may vary slightly"]
    },
    {
      "id": "SH003",
      "order": 3,
      "beat_ids": ["beat-evasion", "beat-recognition"],
      "narrative_purpose": "Turn the untouched envelope into the visible answer and bridge the emotional cut.",
      "duration_seconds": 3.0,
      "subjects": ["mara", "eli"],
      "blocking": "Only forearms enter frame: Mara slowly withdraws her fingertips left; Eli's hand remains near his coffee on the right and never reaches.",
      "action": "The envelope stays sealed at center as Mara removes her hand.",
      "performance_intent": "The withdrawal is small and final, without flourish.",
      "camera": {
        "shot_size": "close insert",
        "position": "above table from established open-booth side",
        "height": "slightly above tabletop",
        "angle": "shallow downward angle",
        "movement": "locked-off",
        "field_of_view": "normal close focus",
        "focus": "envelope and fingertips",
        "composition": "envelope centered, Mara's hand exits left, Eli's hand remains right"
      },
      "screen_direction": "Mara's hand withdraws screen-left; Eli's hand remains screen-right",
      "eyelines": {"mara": "envelope", "eli": "envelope"},
      "lighting_intent": "Same warm overhead practical reflected softly on laminate.",
      "entrance_state": {
        "character_positions": {"mara": "window-side seat, right forearm in frame-left", "eli": "aisle-side seat, hand in frame-right"},
        "body_orientation": {"mara": "toward table", "eli": "toward table"},
        "eyelines": {"mara": "envelope", "eli": "envelope"},
        "movement_direction": {"mara": "fingertips begin moving screen-left", "eli": "still"},
        "current_action": "Eli has finished speaking; Mara begins to withdraw her hand",
        "prop_states": {"ticket-envelope": "sealed at exact table center"},
        "emotional_state": {"mara": "recognition", "eli": "shame"},
        "camera_side": "open end of booth"
      },
      "exit_state": {
        "character_positions": {"mara": "window-side seat, hand outside insert", "eli": "aisle-side seat, hand in frame-right"},
        "body_orientation": {"mara": "toward table", "eli": "toward table"},
        "eyelines": {"mara": "envelope", "eli": "envelope"},
        "movement_direction": {"mara": "hand settled off frame-left", "eli": "still"},
        "current_action": "The untouched envelope remains alone at table center",
        "prop_states": {"ticket-envelope": "sealed and untouched at exact table center"},
        "emotional_state": {"mara": "quiet recognition", "eli": "shame"},
        "camera_side": "open end of booth"
      },
      "continuity_refs": ["mara", "eli", "ticket-envelope"],
      "reference_assets": [],
      "edit_handles": {"head_seconds": 0.5, "tail_seconds": 0.7},
      "tolerances": ["Coffee cup may remain soft and partly cropped"]
    },
    {
      "id": "SH004",
      "order": 4,
      "beat_ids": ["beat-recognition"],
      "narrative_purpose": "Let Mara's recognition, not the prop, end the scene.",
      "duration_seconds": 5.0,
      "subjects": ["mara", "eli"],
      "blocking": "Mara remains window-side; Eli's soft shoulder is foreground-right; Mara looks down, takes one breath, then looks toward Eli and says the line.",
      "action": "Mara says 'I know' and holds his eyeline for one beat.",
      "performance_intent": "Recognition without accusation; the smallest possible change around the eyes.",
      "camera": {
        "shot_size": "close-up over Eli's shoulder",
        "position": "Eli side of the open booth, same established camera half-plane",
        "height": "seated eye level",
        "angle": "three-quarter on Mara",
        "movement": "very slow 10 cm push beginning on her breath",
        "field_of_view": "mild portrait",
        "focus": "Mara's eyes; Eli shoulder soft",